{
  "created_at": "2026-07-23T09:40:00Z",
  "ledger_id": "ledger.std.city.rooftop_concrete_sunset.v1",
  "preset_id": "std.city.rooftop_concrete_sunset",
  "preset_version": "1.0.0",
  "revision": 1,
  "schema_version": "1.0.0",
  "sources": [
    {
      "content_sha256": "ead85ec047d1f426f841988a1b26735e9dfc9373c7b21d494220f0768a240d68",
      "not_authority_for": [
        "identity",
        "body",
        "hair",
        "outfit",
        "brands",
        "readable_text",
        "exact_architecture"
      ],
      "retrieved_at": "2026-07-23T09:40:00Z",
      "rights": {
        "basis": "LICENSED",
        "evidence_sha256": "86a558a192adac12108998fb02dd40db4b72dc06a04c09719d47db91854dacb5",
        "evidence_uri": "evidence/licenses/unsplash-license-2026-07-23.md",
        "rights_holder": "Filip Peeters via Unsplash license",
        "status": "VERIFIED",
        "verified_at": "2026-07-23T09:40:00Z"
      },
      "role": "environment_and_composition_inspiration",
      "snapshot_uri": "evidence/scene-sources/unsplash.fpeeters.json",
      "source_id": "unsplash.fpeeters",
      "url": "https://unsplash.com/photos/cityscape-at-sunset-viewed-from-a-rooftop-bar-fpeeters",
      "use": "rooftop elevation, skyline bokeh depth and sunset horizon color only"
    },
    {
      "content_sha256": "a6d27a6072a3e64ad08b8b04ca414348d0b478ee5dd171794118b61b9c2b742e",
      "not_authority_for": [
        "identity",
        "body",
        "hair",
        "outfit",
        "brands",
        "readable_text",
        "exact_architecture"
      ],
      "retrieved_at": "2026-07-23T09:40:00Z",
      "rights": {
        "basis": "LICENSED",
        "evidence_sha256": "86a558a192adac12108998fb02dd40db4b72dc06a04c09719d47db91854dacb5",
        "evidence_uri": "evidence/licenses/unsplash-license-2026-07-23.md",
        "rights_holder": "Ahmed S. via Unsplash license",
        "status": "VERIFIED",
        "verified_at": "2026-07-23T09:40:00Z"
      },
      "role": "environment_material_inspiration",
      "snapshot_uri": "evidence/scene-sources/unsplash.a7med7.json",
      "source_id": "unsplash.a7med7",
      "url": "https://unsplash.com/photos/a-view-of-a-city-from-a-rooftop-at-night-a7med7",
      "use": "concrete parapet texture and cool evening tone only"
    }
  ],
  "status": "VERIFIED_FOR_RELEASE"
}
