{
  "created_at": "2026-07-23T09:40:00Z",
  "ledger_id": "ledger.std.interior.sheer_curtain_golden_light.v1",
  "preset_id": "std.interior.sheer_curtain_golden_light",
  "preset_version": "1.0.0",
  "revision": 1,
  "schema_version": "1.0.0",
  "sources": [
    {
      "content_sha256": "3aba1226cfd2b15c4d30cd3f04e5c54f16021c2695b22d363d7d0789fa9ecc93",
      "not_authority_for": [
        "identity",
        "body",
        "hair",
        "outfit",
        "brands",
        "readable_text",
        "exact_architecture"
      ],
      "retrieved_at": "2026-07-23T09:40:00Z",
      "rights": {
        "basis": "LICENSED",
        "evidence_sha256": "86a558a192adac12108998fb02dd40db4b72dc06a04c09719d47db91854dacb5",
        "evidence_uri": "evidence/licenses/unsplash-license-2026-07-23.md",
        "rights_holder": "Chris Lee via Unsplash license",
        "status": "VERIFIED",
        "verified_at": "2026-07-23T09:40:00Z"
      },
      "role": "environment_and_composition_inspiration",
      "snapshot_uri": "evidence/scene-sources/unsplash.t54XqY9aK5s.json",
      "source_id": "unsplash.t54XqY9aK5s",
      "url": "https://unsplash.com/photos/a-large-glass-greenhouse-with-an-open-door-t54XqY9aK5s",
      "use": "soft filtered light through fabric and tall window proportion only"
    },
    {
      "content_sha256": "3f4e54c899323369483f4b76fcd449c9165048bd0cf594b8e35285374fd5e137",
      "not_authority_for": [
        "identity",
        "body",
        "hair",
        "outfit",
        "brands",
        "readable_text",
        "exact_architecture"
      ],
      "retrieved_at": "2026-07-23T09:40:00Z",
      "rights": {
        "basis": "LICENSED",
        "evidence_sha256": "86a558a192adac12108998fb02dd40db4b72dc06a04c09719d47db91854dacb5",
        "evidence_uri": "evidence/licenses/unsplash-license-2026-07-23.md",
        "rights_holder": "Alena Lavrova via Unsplash license",
        "status": "VERIFIED",
        "verified_at": "2026-07-23T09:40:00Z"
      },
      "role": "environment_material_inspiration",
      "snapshot_uri": "evidence/scene-sources/unsplash.9XlqHqK5zV8.json",
      "source_id": "unsplash.9XlqHqK5zV8",
      "url": "https://unsplash.com/photos/a-glass-greenhouse-with-greenery-and-walkways-9XlqHqK5zV8",
      "use": "diffused daylight softness and atmospheric particles in light only"
    }
  ],
  "status": "VERIFIED_FOR_RELEASE"
}
