{
  "created_at": "2026-07-23T09:40:00Z",
  "ledger_id": "ledger.std.city.night_neon_wet_asphalt.v1",
  "preset_id": "std.city.night_neon_wet_asphalt",
  "preset_version": "1.0.0",
  "revision": 1,
  "schema_version": "1.0.0",
  "sources": [
    {
      "content_sha256": "06aaa2b58d1885a3fd1b49b5375a7df798172f2c9e94f890f9f3ba5a4bc2a4a9",
      "not_authority_for": [
        "identity",
        "body",
        "hair",
        "outfit",
        "brands",
        "readable_text",
        "exact_architecture"
      ],
      "retrieved_at": "2026-07-23T09:40:00Z",
      "rights": {
        "basis": "LICENSED",
        "evidence_sha256": "86a558a192adac12108998fb02dd40db4b72dc06a04c09719d47db91854dacb5",
        "evidence_uri": "evidence/licenses/unsplash-license-2026-07-23.md",
        "rights_holder": "Desmond Leung via Unsplash license",
        "status": "VERIFIED",
        "verified_at": "2026-07-23T09:40:00Z"
      },
      "role": "environment_and_composition_inspiration",
      "snapshot_uri": "evidence/scene-sources/unsplash.v095s_t1_6o.json",
      "source_id": "unsplash.v095s_t1_6o",
      "url": "https://unsplash.com/photos/concrete-road-beside-building-v095s_t1_6o",
      "use": "wet urban asphalt reflection behavior and moody night atmosphere only"
    },
    {
      "content_sha256": "3db75d7ea6e3639136933bcad9fd44bb3cf8c66a0f5f6f2730ba09ff03059e5e",
      "not_authority_for": [
        "identity",
        "body",
        "hair",
        "outfit",
        "brands",
        "readable_text",
        "exact_architecture"
      ],
      "retrieved_at": "2026-07-23T09:40:00Z",
      "rights": {
        "basis": "LICENSED",
        "evidence_sha256": "86a558a192adac12108998fb02dd40db4b72dc06a04c09719d47db91854dacb5",
        "evidence_uri": "evidence/licenses/unsplash-license-2026-07-23.md",
        "rights_holder": "Darien Attridge via Unsplash license",
        "status": "VERIFIED",
        "verified_at": "2026-07-23T09:40:00Z"
      },
      "role": "lighting_composition_palette_inspiration",
      "snapshot_uri": "evidence/scene-sources/unsplash.X19Lp3_Kk_Q.json",
      "source_id": "unsplash.X19Lp3_Kk_Q",
      "url": "https://unsplash.com/photos/a-car-driving-down-a-rain-soaked-street-at-night-X19Lp3_Kk-Q",
      "use": "neon color reflection on wet surfaces and volumetric fog behavior only"
    }
  ],
  "status": "VERIFIED_FOR_RELEASE"
}
