{
  "created_at": "2026-07-23T09:40:00Z",
  "ledger_id": "ledger.std.nature.ocean_dusk_blue_hour.v1",
  "preset_id": "std.nature.ocean_dusk_blue_hour",
  "preset_version": "1.0.0",
  "revision": 1,
  "schema_version": "1.0.0",
  "sources": [
    {
      "content_sha256": "eb57e88f39b9f5d3f9607f5c2723cde02fb598adce9352788ac33675f533a1bc",
      "not_authority_for": [
        "identity",
        "body",
        "hair",
        "outfit",
        "brands",
        "readable_text",
        "exact_architecture"
      ],
      "retrieved_at": "2026-07-23T09:40:00Z",
      "rights": {
        "basis": "LICENSED",
        "evidence_sha256": "86a558a192adac12108998fb02dd40db4b72dc06a04c09719d47db91854dacb5",
        "evidence_uri": "evidence/licenses/unsplash-license-2026-07-23.md",
        "rights_holder": "Kellen Riggin via Unsplash license",
        "status": "VERIFIED",
        "verified_at": "2026-07-23T09:40:00Z"
      },
      "role": "environment_and_composition_inspiration",
      "snapshot_uri": "evidence/scene-sources/unsplash.h5tG98k2K4U.json",
      "source_id": "unsplash.h5tG98k2K4U",
      "url": "https://unsplash.com/photos/sandy-beach-with-dunes-and-small-houses-along-the-coastline-h5tG98k2K4U",
      "use": "sandy coastline scale, horizon line and wet sand reflections only"
    },
    {
      "content_sha256": "a3dc6878c35be061d019f010d4bdf62a1aeadad34c099c0905715cf0d0248395",
      "not_authority_for": [
        "identity",
        "body",
        "hair",
        "outfit",
        "brands",
        "readable_text",
        "exact_architecture"
      ],
      "retrieved_at": "2026-07-23T09:40:00Z",
      "rights": {
        "basis": "LICENSED",
        "evidence_sha256": "86a558a192adac12108998fb02dd40db4b72dc06a04c09719d47db91854dacb5",
        "evidence_uri": "evidence/licenses/unsplash-license-2026-07-23.md",
        "rights_holder": "Luise and Nic via Unsplash license",
        "status": "VERIFIED",
        "verified_at": "2026-07-23T09:40:00Z"
      },
      "role": "environment_material_inspiration",
      "snapshot_uri": "evidence/scene-sources/unsplash.8zW7xJ9aL2M.json",
      "source_id": "unsplash.8zW7xJ9aL2M",
      "url": "https://unsplash.com/photos/footprints-on-dark-sand-beach-leading-to-ocean-and-coastline-8zW7xJ9aL2M",
      "use": "dark wet sand texture and moody coastal atmosphere only"
    }
  ],
  "status": "VERIFIED_FOR_RELEASE"
}
